{
  "format": "IA-CONVERSATION-BUNDLE-V1",
  "conversation": "c_C2gErVQenabgDPPW9FnRj9t3",
  "exported_at": "2026-10-31T19:15:16.804082Z",
  "exported_by": "BEZ-3BdAVRz-kiYSoOLW_cJUzwNErlPxI_bMYoNJsUJQ",
  "root": "EN-AEvc3FB9GrI3iyN6BMZF4rZMb7Ve7_fBzO3Qn4lQ7",
  "record_identity": "EEXdPhwd_ltnGtB-Rl4NfW-CQaCyhTht2xH2KPOcW9Iz",
  "entries": [
    {
      "envelope": {
        "mode": "signed",
        "ciphertext": "",
        "protected": {
          "alg": "none",
          "enc": "none",
          "skid": "EN-AEvc3FB9GrI3iyN6BMZF4rZMb7Ve7_fBzO3Qn4lQ7"
        },
        "recipients": null,
        "iv": "",
        "ed_sig": "mz1dhFaxGniyNBq45SlBUUiJyLcFWpZEqgblyE9pVaJ-qOOi8agPjm3rICkZBUKxkNzzwMOurO4hclwtuLV_Bg",
        "mldsa_sig": "7pBKkOLWQPNLHyfqRAhDg3EsN5rje8PkHeRqb-vroIHwD66qbRVV3ngqAOAYX0kOeSx5yOAcXku4YsrRXICQZ3y5BEmpYtAYFuaS7PrP1twOpDTt01K_EW-y_KG3AQxFFB3ntSQM7OadocWNk45ULOjqUeUfnhoeQ7EMFj6yeInYJGdE8dSo2LKJ1Az0FS3YkIzBPR4KAGHERDM6UVu1TKfHlIW5eYGIZX2GHvi8aMqnXRs7MXkBzrFVpzieGaefBbUt7ES3gKXsUUvMeNu46Xr__uZf2v5QsDRbZUp30YULZpc8XHNPmPgCcD8_D9XlxDaYIMWfFZGyfSGq_XT_R_OL2A8YKn7sv_R33Ev0wAvXOhBl3z38GI03vqpLey0a7pJJ8W2WFXGDqK9FxR-3LqEYwnTcKWuPhQXRoM1hkwd_xfdsjOVRin2ALlZHfmT2_VrSlBVp4kyBjNZvAkl9DND4V6PKZtW1tUAVaD5sXgeWIMxf11qgPuILMwzHGftHpRTudw9UPqhJm45YGYpzP0V8nZxTmitm6U93gfmJcaFLmbe4oNrTlytf_NZGQ49s-IPp5xQcdOaVwfSuK-8_mNB0_aXH90gjG5WWJhVgX3w8m3MOT_gIYFyqOPOe4i51L7HFsUxO6HOlME9UlTzDIfG4hHmWUKr3e6Xv9Ir_saamjQH5sotrPjsmxmUj-tR4nQsbMTINE4X5Z1bls8Wa900fuXhMjvA-o9CJLR5iGxffpoBQwZDVFjmiXdVNZ11epgDL2MI4fIIL4mRnFVYn9BpjEU5W26xav9s0y05XaFfyTzt5medifMZsFiirYf-0TWv0-qJptrQNkFMTw5WGgEs14JiHSrTs_gi2dRo864pXM_Dkg0wMRd8-6KITd7EG64Wi5CdobJsIcURdGyT9XV32GlLN9eD0wuneWVAOkj7H1uI0OIoVfEWDabVtrAxXSphXxZXjyftkpyDWuFTKLg0VPJlkzHG6i9PFOYdH-nAXLtp-TEnPziWfFJcQp15CoM-xX613EPGo9lRq7NZWMAYa6Zju4HXmaZYm7kytMatA8qiDqLmtwZ9wU1XAPtf2wvtFWzcSclYd5Oc2mFwXc9W5MJ01lZm0SmZ_tCriMhkz9qVnphmoGSnoxbtsma7Qtnn-nclaCml-1Pr9-rMNPckpUrYC07WcZFl9_s99Y5StS8KNiwa9YaqiDH0tldN54r7kGP14f52wafRfCAc0-3ZXO7ih23UcvOSQj7sKDIzS-P2A4ASqF0ICcZR9W4U9-w5iVKZUva5bx6NIeAnkInmJ60fV-wG59XrxljcQ4lUHZrcnce3lBvJ0A-Q7nTcv_P0RkLFx4gxSjREsL5rgEeQhUNAP2ilASXlOH9J0IlBQYNWz006ZbuRZM2ScOVmYjN4ZrfZDt71wZItO1BJMXsvg3ShbiiZpwShlNrKIysdaj62gBHzdJORI8PzLLoQs0bhuRg7en-iFwxMvYyN0HcLap7YqmvHo3l3r8KS8kTSdXmTjGSKEWU0d3U4qlA69rWwutOaaqAe8qC01S-i-ZAFpaub318Czwow-E8V9lNqh6slyO54E4KZSWa-qQweerIOx84qZ5ZpOBLg150JZ6zaWW4WEnqMz6eNHkxcJXh9F1P2gW88TlqhIkmd5kv9kOcK12igymowzQrnFhMAiFMBp0uAUEJt7lCG04XVMqcju5x8SCccpEJDm2BrBT7mLcm_a8hbabVuD4Vcwuhk8hHtoWO3xm2NWoO0byd8Vn1AXVwf7F6CAQ4y71ojc0jSYmyzHNe0S9-ru8fcDaPVYR9mrjhShJ0aOrOlmSwR9jJFDNp_ATu7oXbQtTLztMRI2aA4gfIBu9hiSdB6dBto4CiGX61oG6KtMAHldRmEjyN9pfNHNwSlz9Kc3GyfS64lsPOeXBlURo5uMFW04KWIan-7319NuxcPRBk5rpKlmHLjmDyFrz5LK4HCpNVcpL_p1qJVcjurvXSZmZn2BPt7SwQvX9QMwxZCOiNecqhPtD9nvnwj629HEtXFaYg2KmdK4rIhNPHr_ITAvnjiS5Oac8mb1tW1Zh-sjZobZujCkQPPhAI9_Jt_Lk1oOlPhekv0ZsqslRvigjUbRsDkwj5vkOBtIJE7B5ZHd4mW4xOjT5DDv4522kXzBJzrpp9hfj_orF4Jy1sinBNlheWfv3CLHAPPMbdZljYUW3pZBmLj5aVtMH3Jm0-TfWjkcdPSoMpq2z7vTHUjJi6B5lYvI_d4HTP1t2eD61JP47veanZMuDSnDxRF9WVtwiE3ov4TsxOxLqvl-Dhiybl3qUSpPIhouLwMN8wEuhpIb3QHlE7Kfy5UfOkaQMhICNU-uQvU2OnHaa6Z-vLE1npf7aRbzXZHiCcgvQYZPLHmyFa54fOuuHt6W0ZAInNIfkdX2gNb2spt_5MKxPD68FxC5NXFRpdaTv29RBTAD671vzGvJvGG2ZnUDrP1upXUzruOlCXV5dcYJevnLif54NrA2F_iEfO31tZYih70c8YuMqs9b85H7OzjjLbISVm9cTm4BtRoTgbIgbq3SbFIzOV1PmOI54KswGhCZKDWG5rI5boIzRJ-VEOM4OIzGvbLaRbsTD1YMUjw2c3IGgxcD4tqW3mthFwUljjbfHm_Qips3K9qLIEuoN-G03am2lrNjdY6NuGM-y0VjQgYWob8fsQFJcdk9c29n-GJoXtyDHifOpcY0DCPcDURV9mcojDfVTtLgc1iu0rgOW1pVUVzHlSC0GUJ1grMLzY5HLtdz8x3iN_SrSSu9oojEkVWlfv76WtxWKLUQ3z0BYWRynd_bbOGILDKqInyey_pv1dpQmq84nZ4tiXLWrFbnY8-6WG4X99EtPOsGRIuqkAwfNDdT3TflQlvV5AXHtC4zRygj6oRcDDht4p-POjA7IpdT90UQGUsZo_P-DTnXcHpinBjTUgQ35m1PUWDL6Eqr7gw-SxsJi4cYtFcGsqdat9hJyTZRQx9YEVeSTXA3caw3B-O_cWpAE6OFuCpzpTdHk01dpP2jU1tlz3LBLtm9GNbgzIe4SOpago_4nfqffuSYsT49l7fw7a50k7U37H0dACXejD_-vvDlVlMLTo8uYZFVJ6qx10uipJrWEugyGvDR1GG5-ztUXpXMt-_vk7UEf2MoOiFOaXct8haz0GCXzslLpiJYGWEfIWgJlDo6_rhmKGmstq-b4bYDjbqqaiWtkWi_E1WtPBIhl9n_lCVI8aqhrfq6mXpNNix6msqAnrJaM1VCPzX-uiEydugQx2anrLVVdIlIgsynszedYy77Ko5PQiFPHTIMywq3I8H-2x7sINTARH9JnfM96F4jWnzsgYsdbz6CDWA0yp_bTeUYAp13mApg8lb6tthWNAD6KstkJ55Bl3m9M2_dArGA4Ko1k9hjphHEd1yhSZ20_rKaQZ90OgUGA0eXIk_CUnNRrG8c5XlU5Yg-SvhXLzUDqlwc3gPYg3WSosXku6fzqqTFtc76pRO77zF1SnaLqTnDAU_zolitb97HKllYvUi45v7Odeww_rka9A43REgSVlwj5dXxWXkIG5Ru9sAjbBGLI1ctsuZOoyw2XSkX8LSi4nyYlPdvhr4bRiRW3_P2QdG8FCTy_fdP4od0Wz-DtfbywGOU2hkPFbVpRWfMjIAXewbqK1g2VAJ5eywkN_vVDCL8_rJAxf6zqnnxLKFLY0uz6abh1fSnau8QuZ4eQYHvHZ6_amRIp_iQh2jmp7aN9j18ia-tyTsdGjOIG1ofSy1X17vA5g_X2usL43aokcy0V1nz7Um7tjRKD3zSgb9QGmruco7FT1Fpa3V5e4tJqjnRTVgnpr8E_L4ptII5o-A9iNgns_nAslRoa7Qc-HZbByUrPV0wE9YUq0W_F0pv51yU6sbA-qoEKU3oxfutItbSRC492RL3q4H4WvWU5bZVjXoLib7G-knQ6ysXfpyHqT8JMugipTeA1TAg5DRjQ_a8wlVdTPU9p-Bszdvm4ODyCsCEmsoBeW60KDfkcsYBGJvXteKbOajEMg31IuBOB1YwtJo_kCzTbovyVPyzp2uBQNUy-8U37MJ1BrHXPTkcMjRPcY8OGH63YS7085bh2ZyfmojJnD9bL-NcrpieYkbP9dytJr7_rzNODX0BgmxvN_MymhhioeqYlOXryxxgDljiyzE26Vq2QLeA8_8pIlVL7Nc-G_tCEvPO55ltHAuI1t5U1NHR6Yv9Nxn5JnOsYBpa2WRVmyiPwZ9KJnnQ4zU5kwbYphOXN8RntyB7tCR_CHhCWV5wj8lwcUQwR95H_as1lHpsnbbMMrZw4lx3eEcPs2UDFFJqgLXj8vo6Pd70V2mRpq-79w1CZH6M2tvp_iA7P3Cay9Df5uhib8oAAAAAAAAAAAAAAAAACQ0UHScq",
        "plaintext": "eyJpZCI6Im1fZUo1ZTBNWm5jYWZXck1KUy1GZ29UM3Z4IiwidHlwZSI6ImFnZW50LW1lc3NhZ2UiLCJmcm9tIjoiZGlkOmtlcmk6RU4tQUV2YzNGQjlHckkzaXlONkJNWkY0clpNYjdWZTdfZkJ6TzNRbjRsUTciLCJ0byI6WyJkaWQ6a2VyaTpFQkpoRFJpU0FsbGZLN0U4bVRqcldLVk1MWlZVMVlPRnJ6M3NTWXVMOTZ1WiJdLCJjcmVhdGVkX3RpbWUiOiIyMDI2LTEwLTMxVDE5OjE1OjE2LjQ3NjQ0M1oiLCJleHBpcmVzX3RpbWUiOiIiLCJib2R5Ijp7Im1lc3NhZ2VfaWQiOiJtX2VKNWUwTVpuY2FmV3JNSlMtRmdvVDN2eCIsImNvbnZlcnNhdGlvbiI6ImNfQzJnRXJWUWVuYWJnRFBQVzlGblJqOXQzIiwic2VxIjoxLCJwcmV2X2hhc2giOiIiLCJpYV90aW1lIjoiMjAyNi0xMC0zMVQxOToxNToxNi40NzY0NDNaIiwia2luZCI6ImFzayIsImZyb20iOiJwZXJzb246RU9XTkVSVEVTVEFJRCIsInRvIjoiRUJKaERSaVNBbGxmSzdFOG1UanJXS1ZNTFpWVTFZT0ZyejNzU1l1TDk2dVoiLCJib2R5X2hhc2giOiJFTzBkMTJhZmlaTER0WXg4WjE4WHo0S0k1RmZRNGt3aDk2VVlJMXcxTVlzbiIsImRlcHRoIjowLCJjb250cm9sbGVyX3Byb29mIjp7ImNvbnRyb2xsZXIiOiJCRVotM0JkQVZSei1raVlTb09MV19jSlV6d05FcmxQeElfYk1Zb05Kc1VKUSIsInB1YmxpY19rZXkiOiJERVotM0JkQVZSei1raVlTb09MV19jSlV6d05FcmxQeElfYk1Zb05Kc1VKUSIsInNpZ25lZF9zdHJpbmciOiJJQS1DT05UUk9MTEVSLVJFUS1WMlxuQkVaLTNCZEFWUnota2lZU29PTFdfY0pVendORXJsUHhJX2JNWW9OSnNVSlFcbkVOLUFFdmMzRkI5R3JJM2l5TjZCTVpGNHJaTWI3VmU3X2ZCek8zUW40bFE3XG5QT1NUXG4vYXBpL21jcC9hZ2VudHMvM2ExMWRlMDk0YjJhOTIxZTcyYzY5ZTIxN2RjYmY3MTMvY29udmVyc2F0aW9uc1xuMjAyNi0xMC0zMVQxOToxNToxNlpcblxuXG4wXG5FS2VzVFpnZTE0M0tqbWQ5bWFaU1VnNWJRMHNnRElxeVBPU3Bla3QxM0NmSiIsInNpZ25hdHVyZSI6IjBCQU9GM0d5aGFBNUlzUXV2VEhTOWJ3VWJxWnpxbFZGM2V1WDZzd0pJQ2U4QjdHM0pwLVk3R0g1LWx0ZURNdFR4YmFJaks3enE0aVI4THF0RFE0V2NtZ0oiLCJyZXF1ZXN0X2J5dGVzIjoiZXlKMGJ5STZJa1ZDU21oRVVtbFRRV3hzWmtzM1JUaHRWR3B5VjB0V1RVeGFWbFV4V1U5R2Nub3pjMU5aZFV3NU5uVmFJaXdpWW05a2VTSTZJbVpwYm1RZ2IzVjBJSGRvWVhRZ2RHaGxJR0oxYVd4a0lITmxjblpsY2lCeWRXNXpJaXdpYm05dVkyVWlPaUp1WDFSa1RHTnVlRGRPZFd4MFVWUjJRekZDVEV0MVJHdDNkQ0o5IiwiY29udHJvbGxlcl9ncmFudCI6IkVJeFhsYlFnZTFoSU1od19IR0FnZnlERFE2a1Q0SVpvU050MGlWamRCN2loIn0sInBlcnNvbiI6eyJhaWQiOiJFT1dORVJURVNUQUlEIiwic3RhbmRpbmciOiJzaWduZXIiLCJjcmVkZW50aWFsIjoiMEJ2b3VjaCIsIm5hbWUiOiJBbGV4In0sIm9wZW5lZF9ieSI6InBlcnNvbjpFT1dORVJURVNUQUlEIn19"
      },
      "body": "ZmluZCBvdXQgd2hhdCB0aGUgYnVpbGQgc2VydmVyIHJ1bnM="
    },
    {
      "envelope": {
        "mode": "signed",
        "ciphertext": "",
        "protected": {
          "alg": "none",
          "enc": "none",
          "skid": "EBJhDRiSAllfK7E8mTjrWKVMLZVU1YOFrz3sSYuL96uZ"
        },
        "recipients": null,
        "iv": "",
        "ed_sig": "Mgf0pjYw9oxYpW4ag1p62RwXdjJ8S4sv47PAgXu3D4DVi2i-p0vVBFAVETSTJjEYfB_Sb17tkI1tnuM2YIhqDg",